<?xml version="1.0" encoding="UTF-8"?>
<simulation xmlns:xsi="http://www.w3.org/2001/XMLSchema-instance"
	xmlns:xsd="http://www.w3.org/2001/XMLSchema"
	xsi:noNamespaceSchemaLocation="http://as.tibco.com/simulation.xsd">
	<space name="customers" size="10000" distributionRole="seeder">
		<sequence name="id" start="1" key="true" />
		<firstName name="firstName" />
		<lastName name="lastName" />
		<address name="address" />
		<birthDate name="dob" />
		<regex name="phone" regex="[2-9][0-9]{2}-[0-9]{3}-[0-9]{4}" />
		<emailAddress name="email" />
		<randomWords name="notes" />
		<city name="city" />
		<now name="creationTime" />
	</space>
	<space name="stores" size="10" distributionRole="seeder">
		<sequence name="id" key="true" start="1" />
		<city />
		<double name="latitude" min="40" max="50" />
		<double name="longitude" min="80" max="100" />
	</space>
	<space name="inventory" distributionRole="seeder" batchSize="1"
		sleep="100">
		<integer name="sku" key="true" min="1" max="100" />
		<integer name="store" key="true" min="1" max="10" />
		<integer name="qty" min="0" max="1000" />
	</space>
</simulation>