<?xml version="1.0" encoding="UTF-8"?>
<simulation xmlns:xsi="http://www.w3.org/2001/XMLSchema-instance"
	xsi:noNamespaceSchemaLocation="http://as.tibco.com/simulation.xsd">
	<space name="customer" size="100" distributionRole="seeder">
		<sequence name="id" key="true" />
		<firstName name="firstName" />
		<lastName name="lastName" />
		<address name="address" />
		<birthDate name="dob" />
		<regex name="phone" regex="[2-9][0-9]{2}-[0-9]{3}-[0-9]{4}" />
		<emailAddress name="email" />
		<randomWords name="notes" />
		<city name="city" />
		<now name="creationTime" />
	</space>
</simulation>